ItemTemplate,,,,,,,,,,,,,,,,,,,,,,,,,,,,,,,,,,,,,,,,,,,,,
OrangeVase,,,,,,Glassworks,Glassworking,1,,,,"Glass,4",,2,1,,,None,,A  vase made with glass to brighten up your home.,,None,,,,,,Decoration,Decoration,1,0.4,,Down,,,,,90,Housing Objects,Decoration,Metal,,,,
OutpostNetting,,,,,,,,,,"HewnLog,8",,"LinenYarn,6",,5,2,,,None,,A way to store your items when you run out of floor space.,,Chest,,,,,,,,,,,Up,,,,,180,,,Wood,x,,,
OutpostTable,,,,,x,,,,,"HewnLog,10;WoodBoard,12",,"GlassLens,4;IronBar,6;Paper,8",,5,2,1,Small,None,,An explorers best collection of information is stored here.,,None,Civics,,,,,,,,,,Down,,,,,1200,,,Wood,x,,,
PaddedChair,,,,,,TailoringTable,Tailoring,1,,"HewnLog,10;WoodBoard,20;Fabric,10",,,,8,1,,,None,,A comfy chair to rest in.,,None,,,,,,Living Room,Chair,1.5,0.8,,Down,1,,,,60,Housing Objects,Living Room,Wood,,,,
PaperMachine,,,,,,,,,,,,,,,,,,None,,,,None,,,,,,,,,,,Down,,,,,,,,,x,,,
PictureFrame,,,,,x,,,,,"HewnLog,10",,,,,,,,None,,A frame for displaying pictures.,,None,,,,,,Decoration,Decoration,1,,,,,,,,45,,,,x,,,
PicturePrinter,,,,,,,,,,,,,,,,,,None,,,,None,,,,,,,,,,,,,,,,,,,,x,,,
PlanterPotRound,,,Round Pot,,,Kiln,Pottery,3,,,,"Clay,4",,2,1,,,None,,Sometimes you just want to bring a little bit of nature into your house.,,Linked,,,,,,Decoration,Decoration,1,0.4,,Down,,,,,45,Housing Objects,Decoration,Brick,,,,
PlanterPotSquare,,,Square Pot,,,Kiln,Pottery,3,,,,"Clay,4",,2,1,,,None,,Sometimes you just want to bring a little bit of nature into your house.,,Linked,,,,,,Decoration,Decoration,1,0.4,,Down,,,,,45,Housing Objects,Decoration,Brick,,,,
PlantVase,,,,,,Glassworks,Glassworking,1,,,,"Glass,4",,2,1,,,None,,A  vase made with glass to brighten up your home.,,None,,,,,,Decoration,Decoration,1,0.4,,Down,,,,,90,Housing Objects,Decoration,Metal,,,,
PlasticBenchBlue,,,,,,,,,,,,,,,,,,None,,,,None,,,,,,,,,,,Down,,,,,,,,Paper,x,,,
PlasticBenchGreen,,,,,,,,,,,,,,,,,,None,,,,None,,,,,,,,,,,Down,,,,,,,,Paper,x,,,
PlasticBenchRed,,,,,,,,,,,,,,,,,,None,,,,None,,,,,,,,,,,Down,,,,,,,,Paper,x,,,
PlasticChairBlue,,,,,,,,,,,,,,,,,,None,,,,None,,,,,,,,,,,Down,,,,,,,,Paper,x,,,
PlasticChairGreen,,,,,,,,,,,,,,,,,,None,,,,None,,,,,,,,,,,Down,,,,,,,,Paper,x,,,
PlasticChairRed,,,,,,,,,,,,,,,,,,None,,,,None,,,,,,,,,,,Down,,,,,,,,Paper,x,,,
PlasticTableBlue,,,,,,,,,,,,,,,,,,None,,,,None,,,,,,,,,,,Down,,,,,,,,Paper,x,,,
PlasticTableGreen,,,,,,,,,,,,,,,,,,None,,,,None,,,,,,,,,,,Down,,,,,,,,Paper,x,,,
PlasticTableRed,,,,,,,,,,,,,,,,,,None,,,,None,,,,,,,,,,,Down,,,,,,,,Paper,x,,,
PotteryTable,,,,,,,,,,,,,,,,,,None,,,,None,,,,,,,,,,,Down,,,,,,,,Wood,x,,,
PoweredStorageSilo,,,,,,RoboticAssemblyLine,Industry,3,,,,"SteelPlate,18;AdvancedCircuit,8;Radiator,4;SteelPipe,8",,10,6,,,ElectricCon2,,"A powered silo capable of storing extra large stacks of crops, seeds, and fertilizer. Silos are not able to store other types of materials.",,Medium,,,,,,,,,,,Down,,,,,800,Crafted Objects,Storage,Metal,,,,
PrintingPress,,,,,,,,,,,,,,,,,,None,,,,None,,,,,,,,,,,Down,,,,,,,,,x,,,
PumpJack,,,,,x,AssemblyLine,Mechanics,1,,,,"ReinforcedConcrete,12;Gearbox,4;Piston,8",,20,25,,,ElectricCon1,,"Drill, baby! Drill!",x,Linked,Crafting,,,,,Industrial,,,,,Down,,,,,72,Work Stations,Craft Tables,Metal,,,,
PurpleVase,,,,,,Glassworks,Glassworking,1,,,,"Glass,4",,2,1,,,None,,A  vase made with glass to brighten up your home.,,None,,,,,,Decoration,Decoration,1,0.4,,Down,,,,,90,Housing Objects,Decoration,Metal,,,,
RealEstateDesk,,,,,,CarpentryTable,Carpentry,4,,"HewnLog,15;WoodBoard,10",,"PlantFibers,40",,2,5,0.8,Small,None,,A place to manage the sale and transfer of deeds and property.,,None,Economy,,,,,,,,,,Down,,,,,60,Work Stations,Economic,Wood,,,,
RedVase,,,,,,Glassworks,Glassworking,1,,,,"Glass,4",,2,1,,,None,,A  vase made with glass to brighten up your home.,,None,,,,,,Decoration,Decoration,1,0.4,,Down,,,,,90,Housing Objects,Decoration,Metal,,,,
Refrigerator,,,,,,RoboticAssemblyLine,Industry,4,,,,"SteelPlate,16;BasicCircuit,8;Radiator,3",,10,6,,,ElectricCon1,,An icebox from the future with significantly better cooling properties.,,FoodMedium,,,,,,Kitchen,Food Storage,5,0.3,,Down,,,,,120,Housing Objects,Kitchen,Metal,,,,
Registrar,,,,,x,Sawmill,Carpentry,4,,"Lumber,16;WoodBoard,10",,"IronBar,20",,25,10,1.8,Medium,None,,Allows the setting management of titles.,,None,Economy,,,,,,,,,,Down,,,,,150,Work Stations,Economic,Wood,,,,
ResearchTable,,,,,x,Workbench,,,,"Wood,30;Rock,40",,"PlantFibers,30",,5,,0.5,Small,None,,A basic table for researching new technologies and skills.,x,Linked,Research,,,,,,,,,,Down,,,,,250,Work Stations,Researching,Wood,,,,
RoboticAssemblyLine,,,,,x,ElectronicsAssembly,Electronics,2,,,,"Cement,30;ElectricMotor,5;Servo,12;SteelBar,30",,75,30,2.8,Large,ElectricCon3,,A complex set of machinery for creating equally complex things.,x,Linked,Crafting,,,,,Industrial,,,,,Down,,,,,1200,Work Stations,Craft Tables,Metal,,,ModernUpgrade,IndustryUpgrade;ElectronicsUpgrade
RockerBox,,,,,x,Workbench,BasicEngineering,1,,"WoodBoard,10;Wood,6",,,,5,10,,,None,,A tool for miners to concentrate ore. The run off produces wet tailings.,x,Linked,Crafting,,,,,Industrial,,,,,Down,,,,,100,Work Stations,Craft Tables,Wood,,,BasicUpgrade,MiningBasicUpgrade
RollingMill,,,,,x,AssemblyLine,Mechanics,4,,,,"SteelBar,8;Gearbox,4",,20,5,1.8,Small,ElectricCon2,,For rolling steel into more buildable materials.,x,Linked,Crafting,,,,,Industrial,,,,,Down,,,,,360,Work Stations,Craft Tables,Metal,,,AdvancedUpgrade,AdvancedSmeltingUpgrade
RugLarge,,,,LargeRugs,,Loom;AutomaticLoom,Tailoring,6,,"Fabric,20",,"CelluloseFiber,15;WoolYarn,40",,10,3,,,None,,A large area rug to cover that weird stain.,,None,,,,,,Decoration,Rug,2,0.5,,Down,,,,,120,Housing Objects,Decoration,Canvas,,,,
RugMedium,,,,MediumRugs,,Loom;AutomaticLoom,Tailoring,3,,"Fabric,10",,"CelluloseFiber,5;WoolYarn,20",,6,2,,,None,,A medium rug for medium uses.,,None,,,,,,Decoration,Rug,1,0.5,,Down,,,,,60,Housing Objects,Decoration,Canvas,,,,
RugSmall,,,,SmallRugs,,Loom;AutomaticLoom,Tailoring,1,,,,"WoolYarn,20",,4,1,,,None,,A small rug for when you just didn't have enough materials to make a bigger one.,,None,,,,,,Decoration,Rug,0.5,0.5,,Down,,,,,30,Housing Objects,Decoration,Canvas,,,,
SaltBasket,,,,,,FarmersTable,Farming,3,,"WoodBoard,20",,,,2,3,,,None,,A basket of salt.,,None,,,,,,Kitchen,Spices,1.5,0.4,,Down,,,,,100,Housing Objects,Kitchen,,,,,
Sawmill,,,,,x,Anvil,Smelting,2,,"Wood,16",,"IronBar,4","IronSawBlade,1",6,20,0.8,Small,BasicMechanical3,,Used to saw wood into lumber.,x,Linked,Crafting,,,,,Industrial,,,,,Down,,,,,600,Work Stations,Craft Tables,Wood,,,AdvancedUpgrade,CarpentryAdvancedUpgrade
ScreeningMachine,,,,,x,MachinistTable,Mechanics,3,,,,"IronBar,40;Screws,15;IronGear,10",,5,5,,,BasicMechanical3,,A machine for dry concentration that produces less harmful tailings. Can only be used to concentrate Iron.,x,Linked,Crafting,,,,,Industrial,,,,,Down,,,,,300,Work Stations,Craft Tables,Metal,,,AdvancedUpgrade,MiningAdvancedUpgrade
ScrewPress,,,,,x,MachinistTable,Mechanics,1,,,,"IronBar,25",,5,5,1.7,Small,BasicMechanical2,,A set of smoothing and woodworking tools that assist in creating wheels and transportation.,x,Linked,Crafting,,,,,Industrial,,,,,Down,,,,,300,Work Stations,Craft Tables,Metal,,,AdvancedUpgrade,MechanicsAdvancedUpgrade
SensorBasedBeltSorter,,,,,x,ElectronicsAssembly,Industry,4,,,,"SteelPlate,10;SteelGearbox,5;Rivet,16;AdvancedCircuit,5;BasicCircuit,5","ElectricMotor,1",5,6,,,ElectricCon2,,A machine for dry concentration that produces less harmful tailings. Can only be used to concentrate Iron.,x,Linked,Crafting,,,,,Industrial,,,,,Down,,,,,600,Work Stations,Craft Tables,Metal,,,ModernUpgrade,MiningModernUpgrade
Shaper,,,,,x,MachinistTable,Mechanics,1,,,,"IronPlate,16;Piston,16",,5,5,1.7,Small,BasicMechanical,,A set of smoothing and woodworking tools that assist in creating wheels and transportation.,x,Linked,Crafting,,,,,Industrial,,,,ScrewPress,Down,,,,,300,Work Stations,Craft Tables,Metal,,,AdvancedUpgrade,MechanicsAdvancedUpgrade
SheepMount,,,,,,ButcheryTable,Hunting,4,,"HewnLog,10;Fabric,20",,,"BighornCarcass,1",10,4,,,None,,A hunting trophy for your house.,,None,,,,,,Living Room,Mount,3.5,0.2,,Backward,,,,,300,Housing Objects,Living Room,,,,,
ShelfCabinet,,,,,,Sawmill,Carpentry,5,,"Lumber,14;WoodBoard,16",,,,2,5,,,None,,When a shelf and a cabinet aren't enough individually.,,Small,,,,,,Living Room,Shelves,2,0.5,,Down,,,,,60,Housing Objects,Living Room,Wood,,,,
ShippingContainerBlue,,,,,,,,,,,,,,,,,,None,,,,None,,,,,,,,,,,Down,,,,,,,,,x,,,
ShippingContainerGreen,,,,,,,,,,,,,,,,,,None,,,,None,,,,,,,,,,,Down,,,,,,,,,x,,,
ShippingContainerRed,,,,,,,,,,,,,,,,,,None,,,,None,,,,,,,,,,,Down,,,,,,,,,x,,,
Sink,,,,,,AssemblyLine,Mechanics,4,,,,"SteelBar,8;IronPlate,8",,8,5,,,None,,An industrial sink.,,None,,,,,,Bathroom,Sink,5,0.2,,Down,,,Sink,,110,Housing Objects,Bathroom,Metal,,,,
SmallBathMat,,,,,,Loom,Tailoring,3,,,,"CottonFabric,20",,4,1,,,None,,A small bath mat when a normal rug does not cover your bathroom needs.,,None,,,,,,Bathroom,Rug,1,0.5,,Down,,,,,30,Housing Objects,Bathroom,Canvas,,,,
SmallHangingAshlarBasaltSign,"Basalt,Gneiss,Granite,Limestone,Sandstone,Shale",,,,x,AdvancedMasonryTable,AdvancedMasonry,1,SmallHangingAshlarStoneSign,,,"AshlarBasalt,8",,2,1,,,None,,A small sign for all of your smaller text needs!,,None,,,,x,,,,,,,,,,,,60,Crafted Objects,Signs,Stone,,,,
SmallHangingAshlarStoneSign,,,,,x,AdvancedMasonryTable,AdvancedMasonry,1,,"AshlarStone,8",,,,2,1,,,None,,A small sign for all of your smaller text needs!,,None,,,,x,,,,,,,,,,,,60,Crafted Objects,Signs,Stone,,,,
SmallHangingBirchSign,"Birch,Cedar,Ceiba,Fir,Joshua,Oak,Redwood,Palm,Spruce",,,,x,CarpentryTable,Carpentry,1,SmallHangingWoodSign,"WoodBoard,2;HewnLog,4",,"BirchLog,5",,2,1,,,None,,A small sign for all of your smaller text needs!,,None,,,,x,,,,,,,,,,,,25,Crafted Objects,Signs,Wood,,,,
SmallHangingLumberSign,,,,,x,Sawmill,Carpentry,5,,"WoodBoard,6;Lumber,4",,,,5,2,,,None,,A small sign for all of your smaller text needs!,,None,,,,x,,,,,,,,,,,,60,Crafted Objects,Signs,Wood,,,,
SmallHangingMortaredGraniteSign,"Granite,Limestone,Sandstone",,,,x,MasonryTable,Masonry,1,SmallHangingMortaredStoneSign,,,"MortaredGranite,6",,5,1,,,None,,A small sign for all of your smaller text needs!,,None,,,,x,,,,,,,,,,,,25,Crafted Objects,Signs,Stone,,,,
SmallHangingMortaredStoneSign,,,,,x,MasonryTable,Masonry,1,,"MortaredStone,6",,,,5,1,,,None,,A small sign for all of your smaller text needs!,,None,,,,x,,,,,,,,,,,,25,Crafted Objects,Signs,Stone,,,,
SmallHangingSaguaroSign,,,,,x,CarpentryTable,Carpentry,1,SmallHangingWoodSign,"WoodBoard,2;HewnLog,4",,"SaguaroRib,5",,2,1,,,None,,A small sign for all of your smaller text needs!,,None,,,,x,,,,,,,,,,,,25,Crafted Objects,Signs,Wood,,,,
SmallHangingSoftwoodSign,"Softwood,Hardwood",,,,x,CarpentryTable,Carpentry,1,SmallHangingWoodSign,"HewnLog,4;Softwood,5",,"SoftwoodBoard,2",,2,1,,,None,,A small sign for all of your smaller text needs!,,None,,,,x,,,,,,,,,,,,25,Crafted Objects,Signs,Wood,,,,
SmallHangingStoneSign,,,,,x,,,,,,,,,,,,,None,,A small sign for all of your smaller text needs!,,None,,,,x,,,,,,,,,,,,15,,,Stone,,,,
SmallMeetingChair,,,,,,,,,,,,,,,,,,None,,,,None,,,,,,,,,,,Down,,,,,,,,Wood,x,,,
SmallMeetingTable,,,,,,,,,,,,,,,,,,None,,,,None,,,,,,,,,,,Down,,,,,,,,Wood,x,,,
SmallSink,,,,,,Kiln,Pottery,5,,,,"Clay,30;IronBar,10",,4,2,,,None,,A small household sink.,,None,,,,,,Bathroom,Sink,2,0.7,,Down,,,,,60,Housing Objects,Bathroom,Wood,,,,
SmallStandingAshlarBasaltSign,"Basalt,Gneiss,Granite,Limestone,Sandstone,Shale",,,,x,AdvancedMasonryTable,AdvancedMasonry,1,SmallStandingAshlarStoneSign,,,"AshlarBasalt,8",,2,1,,,None,,A small sign for all of your smaller text needs!,,None,,,,x,,,,,,,Down,,,,,60,Crafted Objects,Signs,Stone,,,,
SmallStandingAshlarStoneSign,,,,,x,AdvancedMasonryTable,AdvancedMasonry,1,,"AshlarStone,8",,,,2,1,,,None,,A small sign for all of your smaller text needs!,,None,,,,x,,,,,,,Down,,,,,60,Crafted Objects,Signs,Stone,,,,
SmallStandingBirchSign,"Birch,Cedar,Ceiba,Fir,Joshua,Oak,Redwood,Palm,Spruce",,,,x,CarpentryTable,Carpentry,5,SmallStandingWoodSign,"WoodBoard,2;HewnLog,4",,"BirchLog,5",,2,1,,,None,,A small sign for all of your smaller text needs!,,None,,,,x,,,,,,,Down,,,,,25,Crafted Objects,Signs,Wood,,,,
SmallStandingLumberSign,,,,,x,Sawmill,Carpentry,5,,"WoodBoard,6;Lumber,4",,,,5,2,,,None,,A small sign for all of your smaller text needs!,,None,,,,x,,,,,,,Down,,,,,60,Crafted Objects,Signs,Wood,,,,
SmallStandingMortaredGraniteSign,"Granite,Limestone,Sandstone",,,,x,MasonryTable,Masonry,1,SmallStandingMortaredStoneSign,,,"MortaredGranite,6",,5,1,,,None,,A small sign for all of your smaller text needs!,,None,,,,x,,,,,,,Down,,,,,25,Crafted Objects,Signs,Stone,,,,
SmallStandingMortaredStoneSign,,,,,x,MasonryTable,Masonry,1,,"MortaredStone,6",,,,5,1,,,None,,A small sign for all of your smaller text needs!,,None,,,,x,,,,,,,Down,,,,,25,Crafted Objects,Signs,Stone,,,,
SmallStandingSaguaroSign,,,,,x,CarpentryTable,Carpentry,1,SmallStandingWoodSign,"WoodBoard,2;HewnLog,4",,"SaguaroRib,5",,2,1,,,None,,A small sign for all of your smaller text needs!,,None,,,,x,,,,,,,Down,,,,,25,Crafted Objects,Signs,Wood,,,,
SmallStandingSoftwoodSign,"Softwood,Hardwood",,,,x,CarpentryTable,Carpentry,1,SmallStandingWoodSign,"HewnLog,4;Softwood,5",,"SoftwoodBoard,2",,2,1,,,None,,A small sign for all of your smaller text needs!,,None,,,,x,,,,,,,Down,,,,,25,Crafted Objects,Signs,Wood,,,,
SmallStandingStoneSign,,,,,x,,,,,,,,,,,,,None,,A small sign for all of your smaller text needs!,,None,,,,x,,,,,,,Down,,,,,15,,,Stone,,,,
SmallStockpile,,,,,,Workbench,,,,"Wood,5",,,,0.5,,,,None,,Designates a 3x3x3 area as storage for large items.,,Linked,,,,,,,,,,,Down,,,,,10,Crafted Objects,Storage,Wood,,,,
SoftwoodLumberBench,"Softwood,Hardwood",,,,,Sawmill,Carpentry,7,LumberBench,"WoodBoard,5",,"SoftwoodLumber,8;Nail,2",,4,3,,,None,,A lumber bench for when you need extra seating space than a traditional chair.,,None,,,,,,Seating,Chair,1.5,0.5,,Down,1,,,,60,Housing Objects,Seating,Wood,,,,
SoftwoodLumberChair,"Softwood,Hardwood",,,,,Sawmill,Carpentry,6,LumberChair,,,"SoftwoodLumber,6;Nail,8",,3,2,,,None,,A sturdy lumber chair. It doesn't feel as wobbly as more basic wooden chairs.,,None,,,,,,Seating,Chair,1,0.7,,Down,1,,,,60,Housing Objects,Seating,Wood,,,,
SoftwoodLumberDoor,"Softwood,Hardwood",DoorObject,,,,Sawmill,Carpentry,5,LumberDoor,,"WoodBoard,4",,"SoftwoodLumber,2",5,1,,,None,,A door made from finely cut lumber.,,None,,,,,,,,,,,Down,,2,,,60,Housing Objects,Doors,Wood,,,,
SoftwoodLumberDresser,,,,,,Sawmill,Carpentry,5,LumberDresser,"WoodBoard,8",,"SoftwoodLumber,6;Nail,8",,4,2,,,None,,A lumber dresser that lets you store your clothing and quickly switch between a designated outfit and whatever you are currently wearing.,,Chest,,,,,,Bedroom,Dresser,3,0.5,,Down,,,,,180,Housing Objects,Bedroom,Wood,,,,
SoftwoodLumberTable,"Softwood,Hardwood",,,,,Sawmill,Carpentry,6,LumberTable,,,"SoftwoodLumber,18;Nail,8",,4,3,,,None,,A large lumber table for eating meals or getting some work done.,,None,,,,,,Seating,Table,2,0.6,,Down,,,,,60,Housing Objects,Seating,Wood,,,,
SolarGenerator,,,,,,ElectronicsAssembly,Electronics,5,,,,"SteelBar,12;Servo,8;BasicCircuit,8",,20,20,,,Solar,,Generates electrical power from the sun! Requires a clear view of the sky above the generator for full output. Internal batteries ensure generation during nighttime.,,None,,,,,Yes,Industrial,,,,,Down,,,,SolarGen,600,Crafted Objects,Power Generation,Metal,,,,
SpinMelter,,,,,,ElectricMachinistTable,Industry,1,,,,"SteelPlate,20;BasicCircuit,10",,15,10,2.8,Small,ElectricCon2,,A device with a rotating drum that is used to shape molten synthetic materials into thin ribbons.,x,Linked,Crafting,,,,,Industrial,,,,,Down,,,,,300,Work Stations,Craft Tables,Metal,,,ModernUpgrade,TailoringModernUpgrade
SpinningJenny,,,,,x,,,2,,"WoodBoard,10",,,"WoodenWheel,1",5,4,,Small,None,,Making yarn and threads made easy!,,None,Crafting,,,,,,,,,,Down,,,,,600,,,Wood,x,,,
StampMill,,,,,x,MachinistTable,Mechanics,2,,"WoodBoard,14",,"IronBar,5;Screws,14;IronGear,8",,5,5,,,BasicMechanical2,,A crushing machine that uses iron stamps to pound rocks into small pieces.,x,Linked,Crafting,,,,,Industrial,,,,,Down,,,,,120,Work Stations,Craft Tables,Wood,,,AdvancedUpgrade,MiningAdvancedUpgrade
StandingGlassSign,,,,,x,Glassworks,Glassworking,2,,"WoodBoard,4",,"Glass,4;Screws,4;SteelBar,2",,3,1,,,None,,A large sign framed with a glass plate.,,None,,,,x,,,,,,,Down,,,,,120,Crafted Objects,Signs,Wood,,,,
StandingLongSteelSign,,,,,x,Anvil,AdvancedSmelting,3,,"WoodBoard,2",,"SteelPlate,6;Rivet,6",,3,1,,,None,,A long steel plate with a wooden base.,,None,,,,x,,,,,,,Down,,,,,120,Crafted Objects,Signs,Metal,,,,
StandingSteelBrickSign,,,,,x,Kiln,Pottery,2,,,,"Brick,5;SteelPlate,4;Mortar,6",,3,1,,,None,,A solid steel plate supported by a brick base.,,None,,,,x,,,,,,,Down,,,,,120,Crafted Objects,Signs,Brick,,,,
SteamEngine,,,,,,MachinistTable,Mechanics,1,,,,"Piston,12;Screws,30;IronPlate,24;Boiler,6;IronGear,16",,10,25,,,SteamGen,Heat,A large steam engine for generating power.,,Linked,,SteamEngine,x,,,Industrial,,,,,Down,,,,SteamEng,450,Crafted Objects,Power Generation,Metal,,x,,
SteelAbstractFixture,,,,,,RoboticAssemblyLine,Electronics,4,,"CompositeLumber,8",,"SteelBar,2;Plastic,6;CopperWiring,5","LightBulb,1",4,5,,,ElectricLamp,,A more modern way to light up a room.,,None,,,,,Yes,Lighting,Lights,3,0.7,,Up,,,,,120,Housing Objects,Lighting,Metal,,,,
SteelCeilingLight,,,,,,RoboticAssemblyLine,Electronics,1,,,,"SteelBar,8;Plastic,6;CopperWiring,5","LightBulb,1",4,5,,,ElectricLamp,,A more modern way to light up a room.,,None,,,,,Yes,Lighting,Lights,3,0.7,,Up,,,,,120,Housing Objects,Lighting,Metal,,,,
SteelFloorLamp,,,,,,RoboticAssemblyLine,Electronics,2,,,,"SteelBar,8;Plastic,6;CopperWiring,5","LightBulb,1",4,5,,,ElectricLamp,,A more modern way to light up a room. This time from the floor.,,None,,,,,Yes,Lighting,Lights,3,0.7,,Down,,,,,120,Housing Objects,Lighting,Metal,,,,
SteelHangingFixture,,,,,,RoboticAssemblyLine,Electronics,4,,"CompositeLumber,6",,"SteelBar,6;Plastic,6;CopperWiring,5","LightBulb,1",4,5,,,ElectricLamp,,A more modern way to light up a room.,,None,,,,,Yes,Lighting,Lights,3,0.7,,Up,,,,,120,Housing Objects,Lighting,Metal,,,,
SteelHangingLamp,,,,,,RoboticAssemblyLine,Electronics,4,,"CompositeLumber,6",,"SteelBar,4;Plastic,6;CopperWiring,5","LightBulb,1",4,5,,,ElectricLamp,,A more modern way to light up a room.,,None,,,,,Yes,Lighting,Lights,3,0.7,,Up,,,,,120,Housing Objects,Lighting,Metal,,,,
SteelKitchenLamp,,,,,,RoboticAssemblyLine,Electronics,3,,,,"SteelBar,6;Plastic,4;CopperWiring,5","LightBulb,1",3,4,,,ElectricLamp,,A more modern way to light up a room.,,None,,,,,Yes,Lighting,Lights,0.8,0.7,,Up,,,,,120,Housing Objects,Lighting,Metal,,,,
SteelMooragePost,,,,,,,,,,,,"SteelBar,10",,5,1,,,None,,An iron moorage post that makes sure that even the largest of vessels stay still.,,None,,,,,,,,,,,Down,,,,,240,,,Metal,x,,,
SteelPodium,,,,,,,,,,,,,,,,,,None,,,,None,,,,,,,,,,,Down,,,,,,,,Metal,x,,,
SteelRowSeating,,,,,,,,,,,,,,,,,,None,,,,None,,,,,,,,,,,Down,,,,,,,,Metal,x,,,
SteelSearchlight,,,,,,RoboticAssemblyLine,Electronics,3,,,,"SteelPlate,8;Rivet,8;CopperWiring,10","LightBulb,4",4,20,,,ElectricLamp,,When your goal is to really light up the heaven!,,None,,,,,Yes,Lighting,Lights,3,0.5,,Down,,,,,120,Housing Objects,Lighting,Metal,,,,
SteelSquareFixture,,,,,,RoboticAssemblyLine,Electronics,3,,"CompositeLumber,8",,"SteelBar,2;Plastic,6;CopperWiring,5","LightBulb,1",4,5,,,ElectricLamp,,A more modern way to light up a room.,,None,,,,,Yes,Lighting,Lights,3,0.7,,Up,,,,,120,Housing Objects,Lighting,Metal,,,,
SteelTableLamp,,,,,,RoboticAssemblyLine,Electronics,2,,,,"SteelBar,8;Plastic,6;CopperWiring,5","LightBulb,1",4,5,,,ElectricLamp,,"For late night studying. Or working. Or anything, really.",,None,,,,,Yes,Lighting,Lights,3,0.7,,Down,,,,,120,Housing Objects,Lighting,Metal,,,,
StenographersTable,,,,,x,,,,,"HewnLog,8;WoodBoard,8",,"IronBar,4;Paper,12",,5,2,2,Small,None,,Documenting a court case is of vital importance and a dedicated unique typewriter is required for this purpose and of course its own table to place it on.,,None,Civics,,,,,,,,,,Down,,,,,1200,,,Wood,x,,,
Stockpile,,,,,,Workbench,,,,"Wood,10",,,,1,,,,None,,Designates a 5x5x5 area as storage for large items.,,Linked,,,,,,,,,,,Down,,,,,25,Crafted Objects,Storage,Wood,,,,
StoneBrazier,,,,,,MasonryTable,Masonry,1,,"Rock,15",,,,4,2,,,PrimitiveLight,Heat,A stone stand which can hold burning fuel to provide light.,,Linked,,,,,Yes,Lighting,Lights,1,0.7,,Down,,,,,25,Housing Objects,Lighting,Stone,,,,
StoneDoor,,DoorObject,,,,,,,,,,,,,,,,None,,A heavy stone door.,,None,,,,,,,,,,,Down,,1,,,15,,,Stone,x,,,
StopSign,,,,,,WainwrightTable,BasicEngineering,2,,,,"IronBar,8",,2,1,,,None,,A traffic sign used to notify drivers to come to a complete stop and make sure the interesection is clear before proceeding.,,None,,,,,,,,,,,Down,,,,,60,Crafted Objects,Community,Metal,,,,
StorageChest,,,,,,Workbench,,,,"Wood,10",,,,1,,,,None,,A container you can store items in.,,Chest,,,,,,,,,,,,,,,,25,Crafted Objects,Storage,Wood,,,,
StorageSilo,,,,,,Sawmill,Carpentry,3,,"Lumber,20",,"IronPipe,6;IronBar,8",,10,3,,,None,,"A wooden silo capable of storing extra large stacks of crops, seeds, and fertilizer. Silos are not able to store other types of materials.",,Medium,,,,,,,,,,,Down,,,,,600,Crafted Objects,Storage,Wood,,,,
Store,,,,,x,Workbench,,,,"Wood,10;Rock,10",,,,5,,0.8,Small,None,,Allows the selling and trading of items.,,Linked,Economy,,,,,,,,,,Down,,,,,100,Work Stations,Economic,Wood,,,,
Stove,,,,,x,ElectricMachinistTable,Mechanics,5,,,,"SteelPlate,16;Rivet,12",,10,5,2.8,Small,ElectricCon2,,A heavy stove for cooking more complex dishes.,x,Linked,Cooking,Stove,X,,,Kitchen,Cooking,3,0.3,,Down,,,,,900,Housing Objects,Kitchen,Metal,,x,AdvancedUpgrade,AdvancedCookingUpgrade
Streetlamp,,,,,,RoboticAssemblyLine,Electronics,5,,,,"SteelBar,12;Glass,5;CopperWiring,5","LightBulb,1",6,5,,,ElectricCon1,,A towering metal light post that requires electricity to run.,,None,,,,,Yes,Lighting,Lights,3,0.7,,Down,,,,,60,Housing Objects,Lighting,Metal,,,,
StreetSign,,,,,x,WainwrightTable,BasicEngineering,2,,,,"IronBar,8",,2,1,,,None,,A metal sign that is especially useful when placed alongside a road to provide information or give instructions to road users.,,None,,,,x,,,,,,,Down,,,,,60,Crafted Objects,Signs,Metal,,,,
StudentsDeskT1,,,,,,,,,,,,,,,,,,None,,,,None,,,,,,,,,,,Down,,,,,,,,Wood,x,,,
StudentsDeskT2,,,,,,,,,,,,,,,,,,None,,,,None,,,,,,,,,,,Down,,,,,,,,Wood,x,,,
StudentsDeskT3,,,,,,,,,,,,,,,,,,None,,,,None,,,,,,,,,,,Down,,,,,,,,Wood,x,,,
StuffedAlligator,,,,,,ButcheryTable,Hunting,5,,"Lumber,5;Fabric,20",,,"AlligatorCarcass,1",12,4,,,None,,It looks so real!,,None,,,,,,Decoration,Statue,3,0.1,,Down,,,,,300,Housing Objects,Decoration,,,,,
StuffedBison,,,,,,ButcheryTable,Hunting,5,,"Lumber,5;Fabric,20",,,"BisonCarcass,1",12,4,,,None,,It looks so real!,,None,,,,,,Decoration,Statue,3,0.1,,Down,,,,,300,Housing Objects,Decoration,,,,,
StuffedElk,,,,,,ButcheryTable,Hunting,5,,"Lumber,5;Fabric,20",,,"ElkCarcass,1",12,4,,,None,,It looks so real!,,None,,,,,,Decoration,Statue,3,0.1,,Down,,,,,300,Housing Objects,Decoration,,,,,
StuffedGoat,,,,,,ButcheryTable,Hunting,5,,"Lumber,5;Fabric,20",,,"MountainGoatCarcass,1",12,4,,,None,,It looks so real!,,None,,,,,,Decoration,Statue,3,0.1,,Down,,,,,300,Housing Objects,Decoration,,,,,
StuffedJaguar,,,,,,ButcheryTable,Hunting,5,,"Lumber,5;Fabric,20",,,"JaguarCarcass,1",12,4,,,None,,It looks so real!,,None,,,,,,Decoration,Statue,3,0.1,,Down,,,,,300,Housing Objects,Decoration,,,,,
StuffedWolf,,,,,,ButcheryTable,Hunting,5,,"Lumber,5;Fabric,20",,,"WolfCarcass,1",12,4,,,None,,It looks so real!,,None,,,,,,Decoration,Statue,2.5,0.2,,Down,,,,,300,Housing Objects,Decoration,,,,,
SwirlVase,,,,,,Glassworks,Glassworking,1,,,,"Glass,4",,2,1,,,None,,A  vase made with glass to brighten up your home.,,None,,,,,,Decoration,Decoration,1,0.4,,Down,,,,,90,Housing Objects,Decoration,Metal,,,,
TailoringTable,,,,,x,CarpentryTable,Carpentry,1,,"WoodBoard,20",,"PlantFibers,50",,10,5,0.8,Small,None,,Spearhead the fashion movement with the finest clothes and hair!,x,Linked,Crafting,,,,,Industrial,,,,,Down,,,,,360,Work Stations,Craft Tables,Wood,,,BasicUpgrade,TailoringUpgrade
TallowCandle,,,,,,FarmersTable,Farming,2,,,,"Tallow,4","CottonThread,1",2,0.5,,,CandleLight,Light,A candle which can burn tallow to produce a small amount of light.,,Linked,,,,,Yes,Lighting,Lights,0.8,0.7,,Down,,,,,50,Housing Objects,Lighting,,,,,
TallowLamp,,,,,,Kiln,Masonry,2,,,,"Clay,2;Tallow,4","CottonThread,1",2,2,,,CandleLight,Light,A pottery lamp. Fuel with tallow.,,Linked,,,,,Yes,Lighting,Lights,1.2,0.7,,Down,,,,,50,Housing Objects,Lighting,,,,,
TallowWallLamp,,,,,,Anvil,Smelting,3,,,,"IronBar,3;Tallow,4","CottonThread,1",3,3,,,CandleLight,Light,A candle mounted on a wall bracket which can burn tallow to produce a small amount of light.,,Linked,,,,,Yes,Lighting,Lights,1.2,0.7,,Backward,,,,,50,Housing Objects,Lighting,,,,,
TeachersDeskT1,,,,,,,,,,,,,,,,,,None,,,,None,,,,,,,,,,,Down,,,,,,,,Wood,x,,,
TeachersDeskT2,,,,,,,,,,,,,,,,,,None,,,,None,,,,,,,,,,,Down,,,,,,,,Wood,x,,,
TeachersDeskT3,,,,,,,,,,,,,,,,,,None,,,,None,,,,,,,,,,,Down,,,,,,,,Wood,x,,,
TinyStockpile,,,,,,Workbench,,,,"Wood,2",,,,0.5,,,,None,,Designates a 2x3x2 area as storage for large items.,,Linked,,,,,,,,,,,Down,,,,,5,Crafted Objects,Storage,Wood,,,,
Toilet,,,,,,Kiln,Pottery,5,,,,"Clay,30;IronBar,10",,4,2,,,None,,"When you gotta go, you gotta go.",,None,,,,,,Bathroom,Toilet,3,0.1,,Down,1,,,,120,Housing Objects,Bathroom,Wood,,,,
ToolBench,,,,,x,Campsite;Workbench,,,,"Wood,20;Rock,10",,,,1,,,,None,,A place to craft and fix up tools.,x,Linked,Crafting,,,,,,,,,,Down,,,,,50,Work Stations,Craft Tables,Wood,,,,
