ItemTemplate,,,,,,,,,,,,,,,,,,,,,,,,,,,,,,,,,,,,,,,,,,,,,
Name,ParentItem,ParentTable,SecondTable,ReqLevel,Skill,CraftTime,Weight,RepairType,MaxUses,NoDefault,ParentRecipe,TagRecipe,Ingredients,StaticIngredients,Products,Fuel,Yield,PluralName,Description,BlockChunks,RequireModule,FriendlyName,Category,Tags,CraftExperience,Labor,BackingCurrency,EcopediaCategory,EcopediaPage,,,,,,,,,,,,,,,,
AdvancedCircuit,,ElectronicsAssembly,,2,Electronics,0.8,1000,,,,,,"CopperWiring,4;GoldWiring,4;GoldFlakes,10;Substrate,2",,,,,,A complex electrical component used in advanced electronics.,,,,Material,,4,85,,Items,Products,,,,,,,,,,,,,,,,
AdvancedCombustionEngine,,RoboticAssemblyLine,,1,Industry,4,1000,,,,,,"SteelPlate,16;Rivet,12;Piston,6;Valve,6;Servo,6;AdvancedCircuit,6;Radiator,3",,,,,,A more advanced version of the normal combustion engine that produces a greater output.,,,,Material,,20,600,,Items,Products,,,,,,,,,,,,,,,,
AgoutiCarcass,,,,,,,2000,,,,,,,,,,,,A dead agouti.,,,,Animal,"TinyFurCarcass,1;TinyCarcass,1",,,,Natural Resources,Animal,,,,,,,,,,,,,,,,
AgricultureResearchPaperAdvanced,,ResearchTable,,0,Farming,,10,,,,,"Raw Food,40;Crop Seed,20","Dirt,5",,,,,,A document containing important research information. Used to discover new skills at the research table.,,,,Research,"Advanced Research,1;Research,1",3,240,,Items,Research Papers,,,,,,,,,,,,,,,,
AgricultureResearchPaperModern,,ResearchTable,,0,Farming,,10,,,,,"Raw Food,200","BerryExtractFertilizer,5;BloodMealFertilizer,5;HideAshFertilizer,5;PeltFertilizer,5",,,,,,A document containing important research information. Used to discover new skills at the research table.,,,,Research,"Modern Research,1;Research,1",6,600,,Items,Research Papers,,,,,,,,,,,,,,,,
AlligatorCarcass,,,,,,,2000,,,,,,,,,,,,A dead alligator.,,,,Animal,"MediumCarcass,1;MediumLeatherCarcass,1",,,,Natural Resources,Animal,,,,,,,,,,,,,,,,
Arrow,,ToolBench,,,,0.1,10,,,,,"Wood,1",,,,500,4,,Use with the bow to hunt for food (or amaze your friends by shooting apples off of their heads).,,,,Tool,"Burnable Fuel,1",,30,,Items,Tools,,,,,,,,,,,,,,,,
BasicCircuit,,ElectronicsAssembly,,1,Electronics,0.8,1000,,,,,,"CopperWiring,6;GoldFlakes,10;Substrate,2",,,,,,A complex electrical component used in advanced electronics.,,,,Material,,4,45,,Items,Products,,,,,,,,,,,,,,,,
Bass,,,,,,,800,,,,,,,,,,,,A bass. ,,,,Animal,"Fish,1;MediumFish,1",,,,Natural Resources,Animal,,,,,,,,,,,,,,,,
BeaverCarcass,,,,,,,1000,,,,,,,,,,,,A dead beaver.,,,,Animal,,,,,,,,,,,,,,,,,,,,,,
BighornCarcass,,,,,,,3500,,,,,,,,,,,,A dead bighorn.,,,,Animal,"MediumCarcass,1;MediumWoolyCarcass,1",,,,Natural Resources,Animal,,,,,,,,,,,,,,,,
BisonCarcass,,,,,,,5500,,,,,,,,,,,,A dead bison.,,,,Animal,,,,,Natural Resources,Animal,,,,,,,,,,,,,,,,
BlueShark,,,,,,,2000,,,,,,,,,,,,A blue shark.,,,,Animal,"Fish,1;LargeFish,1",,,,Natural Resources,Animal,,,,,,,,,,,,,,,,
Board,,CarpentryTable,,1,Carpentry,0.2,500,,,,,"HewnLog,1",,,,2000,,,A higher quality board used for long lasting furniture.,,,,Material,"WoodBoard,1;Burnable Fuel,1",0.6,25,x,Items,Products,,,,,,,,,,,,,,,,
Boiler,,MachinistTable,,1,Mechanics,2,500,,,,,,"IronPlate,15;Screws,10;CopperPlate,4",,,,,,A vessel used for heating fluids.,,Shaper,,Material,,3,180,,Items,Products,,,,,,,,,,,,,,,,
Camera,Tool,,,,,,,,,,,,,,,,,,,,,,Tool,,,,,,,,,,,,,,,,,,,,,,
CelluloseFiber,,TailoringTable,,1,Tailoring,1,100,,,,,"NaturalFiber,20",,,,,,,Created by taking pulped plants and extruding them similarly to synthetic fibers.,,,,Material,,0.5,60,,Items,Products,,,,,,,,,,,,,,,,
Cement,,CementKiln,,4,Masonry,1.6,10000,,,,,,"CrushedLimestone,3;Clay,1",,,,2,Cement,In order to be usable it needs to be reinforced.,,,,Material,,1,70,,Items,Products,,,,,,,,,,,,,,,,
Charcoal,,Kiln,,4,Logging,1,1000,,,,,"Wood,7",,,,20000,,,"A black residue, consisting of carbon and any remaining ash.",,,,Fuel,"Coal,1;Burnable Fuel,1",1,25,,Items,Products,,,,,,,,,,,,,,,,
Clam,,,,,,,100,,,,,,,,,,,,A clam.,,,,Animal,"Marine Life,1",,,x,Natural Resources,Animal,,,,,,,,,,,,,,,,
Cloth,,TailoringTable,,1,Tailoring,1,100,,,,,,"PlantFibers,9",,,,,Cloth,A piece of rough cloth made by weaving fibers together.,,,,Material,"Fabric,1",0.5,60,,Items,Products,,,,,,,,,,,,,,,,
CO2Canister,,Laboratory,,1,CuttingEdgeCooking,8,100,,,,,,"SteelBar,2",,,,,,For creating fancy foams!,,,CO2 Canister,,,1,15,,Items,Products,,,,,,,,,,,,,,,,
Cod,,,,,,,1000,,,,,,,,,,,,A cod.,,,,Animal,"Fish,1;MediumFish,1",,,,Natural Resources,Animal,,,,,,,,,,,,,,,,
CombustionEngine,,ElectricMachinistTable,,3,Mechanics,8,5000,,,,,,"Piston,6;Gearbox,4;IronPlate,12;Rivet,8",,,,,,An engine that generates power by combustion of fuel.,,,,Material,,15,300,,Items,Products,,,,,,,,,,,,,,,,
CopperPlate,,ScrewPress,,1,Mechanics,2,500,,,,,,"CopperBar,1",,,,,,A solid copper plate giving higher grades of protection against erosion and improves conductivity.,,MachinistTable,,Material,,1,60,x,Items,Products,,,,,,,,,,,,,,,,
CopperWiring,,MachinistTable,,1,Mechanics,0.4,200,,,,,,"CopperBar,4",,,,2,CopperWiring,A length of copper conductive wire useful for a variety of purposes.,,,,Material,,1,60,,Items,Products,,,,,,,,,,,,,,,,
CottonBoll,,,,,,,10,,,,,,,,,,,,A fluffy round boll harvested from a cotton plant. The seeds must be separated from their protective case before the cotton fiber can be spun into thread.,,,,Material,"Crop,1",,,,Items,Products,,,,,,,,,,,,,,,,
CottonFabric,,Loom,,1,Tailoring,1,100,,,,,,"CottonThread,4",,,,,CottonFabric,"Cotton fabric is valued for its light weight, breathability, and softness.",,,,Material,"Fabric,1",0.5,60,x,Items,Products,,,,,,,,,,,,,,,,
CottonLint,,FarmersTable,,1,Farming,1,100,,,,,,"CottonBoll,4",,"CottonSeed,0.5",,,CottonLint,A bundle of cotton used as stuffing or further tailoring processing.,,,,Material,,0.1,80,,Items,Products,,,,,,,,,,,,,,,,
CottonThread,,TailoringTable,,1,Tailoring,1,20,,,,,,"CottonLint,1",,,,2,CottonThread,Cotton fiber that has been processed at a cotton gin and is ready to be used for textiles.,,,,Material,,0.1,30,,Items,Products,,,,,,,,,,,,,,,,
CoyoteCarcass,,,,,,,2000,,,,,,,,,,,,A dead coyote.,,,,Animal,"SmallCarcass,1",,,,Natural Resources,Animal,,,,,,,,,,,,,,,,
CrabCarcass,,,,,,,2000,,,,,,,,,,,,"A crustacean that loves the ocean, just don't get caught in its pinch!",,,,Animal,"SmallFish,1",,,,Natural Resources,Animal,,,,,,,,,,,,,,,,
CulinaryResearchPaperAdvanced,,ResearchTable,,1,Baking,,10,,,,,"BakedVegetable,16;Salad,10",,,,,,,A document containing important research information. Used to discover new skills at the research table.,,,,Research,"Advanced Research,1;Research,1",3,120,,Items,Research Papers,,,,,,,,,,,,,,,,
CulinaryResearchPaperBasic,,ResearchTable,,1,CampfireCooking,,10,,,,,"FriedVegetable,3;CampfireSalad,5",,,,,,,A document containing important research information. Used to discover new skills at the research table.,,,,Research,"Basic Research,1;Research,1",1.5,30,,Items,Research Papers,,,,,,,,,,,,,,,,
CulinaryResearchPaperModern,,ResearchTable,,2,AdvancedCooking,,10,,,,,,"BoiledSausage,10;Bread,10",,,,,,A document containing important research information. Used to discover new skills at the research table.,,,,Research,"Modern Research,1;Research,1",6,600,,Items,Research Papers,,,,,,,,,,,,,,,,
DeerCarcass,,,,,,,3000,,,,,,,,,,,,A dead deer.,,,,Animal,"MediumCarcass,1;MediumLeatherCarcass,1",,,,Natural Resources,Animal,,,,,,,,,,,,,,,,
DendrologyResearchPaperAdvanced,,ResearchTable,,0,Carpentry,,10,,,,,"HewnLog,20",,,,,,,A document containing important research information. Used to discover new skills at the research table.,,,,Research,"Advanced Research,1;Research,1",3,120,,Items,Research Papers,,,,,,,,,,,,,,,,
DendrologyResearchPaperBasic,,ResearchTable,,0,Logging,,10,,,,,"Wood,20",,,,,,,A document containing important research information. Used to discover new skills at the research table.,,,,Research,"Basic Research,1;Research,1",1.5,30,,Items,Research Papers,,,,,,,,,,,,,,,,
DendrologyResearchPaperModern,,ResearchTable,,0,Carpentry,,10,,,,,"Lumber,30",,,,,,,A document containing important research information. Used to discover new skills at the research table.,,,,Research,"Modern Research,1;Research,1",6,600,,Items,Research Papers,,,,,,,,,,,,,,,,
EckoTheDolphin,Tool,,,,,,0,,,,,,,,,,,,"Ecko, the dolphin god of Eco bugs. Handle with care and lightly sprinkle with water every so often to keep moist.",,,,Tool,,,,,,,,,,,,,,,,,,,,,,
ElectricMotor,,ElectronicsAssembly,,1,Electronics,2,1000,,,,,,"BasicCircuit,4;CopperWiring,10;SteelBar,8",,,,,,A motor.,,,,Material,,10,360,,Items,Products,,,,,,,,,,,,,,,,
ElkCarcass,,,,,,,3000,,,,,,,,,,,,A dead elk.,,,,Animal,"MediumCarcass,1;MediumLeatherCarcass,1",,,,Natural Resources,Animal,,,,,,,,,,,,,,,,
EngineeringResearchPaperAdvanced,,ResearchTable,,1,BasicEngineering,,10,,,,,,"Waterwheel,2;Windmill,2",,,,,,A document containing important research information. Used to discover new skills at the research table.,,,,Research,"Advanced Research,1;Research,1",1.5,120,,Items,Research Papers,,,,,,,,,,,,,,,,
EngineeringResearchPaperModern,,ResearchTable,,1,Mechanics,,10,,,,,,"IronAxle,8;IronPlate,8;IronGear,20",,,,,,A document containing important research information. Used to discover new skills at the research table.,,,,Research,"Modern Research,1;Research,1",3,600,,Items,Research Papers,,,,,,,,,,,,,,,,
Epoxy,,OilRefinery,,1,OilDrilling,1.5,1000,,,,,,"Petroleum,4",,"Barrel,3,-",,2,Epoxy,"A useful material for hardening, curing, and other various uses.",,,,Material,,1,180,,Items,Products,,,,,,,,,,,,,,,,
Ethanol,,,,,,,1000,,,,,,,,,,,,A material used to make biodiesel. Not suitable for food.,,,,Material,,,,,Items,Products,,,,,,,,,,,,,,,,
Fiberglass,,ElectronicsAssembly,,1,Glassworking,2,1000,,,,,,"Plastic,4;Glass,2",,,,,Fiberglass,Plastic reinforced with glass fiber strands.,,,,Material,,1,90,,Items,Products,,,,,,,,,,,,,,,,
FishingPole,,Fishery,,,,5,1000,,,,,"Wood,10",,,,,,,"Fishing, the most extreme sport.",,,,Tool,"Tool,1",,25,,Items,Tools,,,,,,,,,,,,,,,,
FlaxFiber,,,,1,,5,100,,,,,,"FlaxStem,6",,"PlantFibers,1",,1,,Processed fibers of flax ready to be spun into yarn.,,,,Material,,1,50,,,,,,,,,,,,,,,,,,,
FlaxStem,,,,,,,10,,,,,,,,,,,,A bundle of harvested flax that can be processed into fabric.,,,,Material,,,,,,,,,,,,,,,,,,,,,,
FlaxTrawlerNet,VehicleTool,,,,,2,5000,Cloth,500,,,"Fabric,15",,,,,,,A sturdy basic combination of lines making a mesh used for catching fish on a larger scale.,,,,Tool,,10,120,,,,,,,,,,,,,,,,,,,
FoxCarcass,,,,,,,2000,,,,,,,,,,,,A dead fox.,,,,Animal,"SmallCarcass,1",,,,Natural Resources,Animal,,,,,,,,,,,,,,,,
FurPelt,,,,,,,500,,,,,,,,,,,,"A soft, furry pelt.",,,,Material,"Animal Skin,1",,,x,Items,Products,,,,,,,,,,,,,,,,
GatheringResearchPaperBasic,,ResearchTable,,0,Gathering,,10,,,,,"Raw Food,30","PlantFibers,20",,,,,,A document containing important research information. Used to discover new skills at the research table.,,,,Research,"Basic Research,1;Research,1",1.5,30,,Items,Research Papers,,,,,,,,,,,,,,,,
Gearbox,,Shaper,,1,Mechanics,1.5,500,,,,,,"IronBar,2;IronGear,4",,,,,,Provides speed and torque conversions from a rotating power source to another device.,,MachinistTable,,Material,,2,45,,Items,Products,,,,,,,,,,,,,,,,
GeologyResearchPaperAdvanced,,ResearchTable,,0,Masonry,,10,,,,,"MortaredStone,20",,,,,,,A document containing important research information. Used to discover new skills at the research table.,,,,Research,"Advanced Research,1;Research,1",3,120,,Items,Research Papers,,,,,,,,,,,,,,,,
GeologyResearchPaperBasic,,ResearchTable,,0,Mining,,10,,,,,"Rock,30",,,,,,,A document containing important research information. Used to discover new skills at the research table.,,,,Research,"Basic Research,1;Research,1",1.5,30,,Items,Research Papers,,,,,,,,,,,,,,,,
GeologyResearchPaperModern,,ResearchTable,,0,Pottery,,10,,,,,,"Brick,30",,,,,,A document containing important research information. Used to discover new skills at the research table.,,,,Research,"Modern Research,1;Research,1",6,600,,Items,Research Papers,,,,,,,,,,,,,,,,
GlassLens,,,,1,,1,500,,,,,,"Glass,6",,,,2,,A thin shaped piece of glass very useful for devices used to interact with light.,,,,Material,,0.1,30,,,,,,,,,,,,,,,,,,,
GoldFlakes,,ElectronicsAssembly,,1,Electronics,0.8,500,,,,,,"GoldBar,2",,,,4,GoldFlakes,A highly efficient conductor for delicate electronics.,,,,Material,,1,75,,Items,Products,,,,,,,,,,,,,,,,
GoldWiring,,ElectricMachinistTable,,4,Mechanics,0.4,200,,,,,,"GoldBar,4",,,,2,GoldWiring,A length of gold conductive wire useful for a variety of purposes.,,,,Material,,1,120,,Items,Products,,,,,,,,,,,,,,,,
HardwoodBoard,,CarpentryTable,,1,Carpentry,0.2,500,,,,Board,,"HardwoodHewnLog,1",,,2000,,,A higher quality hardwood board used for long lasting furniture.,,,,Material,"WoodBoard,1;Burnable Fuel,1",0.6,25,x,Items,Products,,,,,,,,,,,,,,,,
HareCarcass,,,,,,,1000,,,,,,,,,,,,A dead hare.,,,,Animal,"TinyCarcass,1",,,,Natural Resources,Animal,,,,,,,,,,,,,,,,
HeatSink,,Shaper,,2,Mechanics,2,500,,,,,,"CopperPlate,8;CopperWiring,6",,,,,,A copper plate to draw and disperse heat.,,MachinistTable,,Material,,2,60,,Items,Products,,,,,,,,,,,,,,,,
IronAxle,,Lathe,,1,Mechanics,2,500,,,,,,"IronBar,2",,,,,,A rotating iron rod that can be fixed to wheels for use in vehicles.,,MachinistTable,,Material,,1,75,,Items,Products,,,,,,,,,,,,,,,,
IronGear,,Shaper,,1,Mechanics,0.4,500,,,,,,"IronBar,1",,,,,,A toothed machine part that interlocks with others.,,,,Material,"Gear,1",1,75,,Items,Products,,,,,,,,,,,,,,,,
IronPlate,,ScrewPress,,1,Mechanics,2,500,,,,,,"IronBar,1",,,,,,A solid iron plate for use in various crafting recipes.,,MachinistTable,,Material,,1,60,x,Items,Products,,,,,,,,,,,,,,,,
IronSawBlade,,Anvil,,2,Smelting,1.2,100,,,,,,"IronBar,6",,,,,,A disc shaped iron saw that can be attached to rotary machines to shape wood products.,,,,Material,,2,60,,Items,Products,,,,,,,,,,,,,,,,
IronWheel,,WainwrightTable,,3,BasicEngineering,2,500,,,,,,"IronBar,6",,,,,,A sturdy iron wheel that can support heavier vehicles than early wooden wheels.,,,,Material,,1,100,,Items,Products,,,,,,,,,,,,,,,,
JaguarCarcass,,,,,,,2000,,,,,,,,,,,,A dead Jaguar.,,,,Animal,"MediumCarcass,1;MediumLeatherCarcass,1",,,,Natural Resources,Animal,,,,,,,,,,,,,,,,
Kelp,,,,,,,100,,,,,,,,,,,,Some creepy kelp.,,,,Material,"NaturalFiber,1",,,,Items,Products,,,,,,,,,,,,,,,,
LargeHangingWoodSign,,CarpentryTable,,3,Carpentry,3,,,,x,,"WoodBoard,5;HewnLog,4;Wood,10",,,,,,,A large sign for all of your larger text needs!,,,,,,2,60,,,,,,,,,,,,,,,,,,,
LargeStandingWoodSign,,CarpentryTable,,3,Carpentry,3,,,,x,,"WoodBoard,5;HewnLog,4;Wood,10",,,,,,,A large sign for all of your larger text needs!,,,,,,2,60,,,,,,,,,,,,,,,,,,,
LeatherHide,,,,,,,500,,,,,,,,,,,,A thick hide.,,,,Material,"Animal Skin,1",,,x,Items,Products,,,,,,,,,,,,,,,,
LightBulb,,Glassworks,,2,Glassworking,2,50,,,,,,"Glass,2;CopperWiring,6",,,,,,An electric light with a wire filament.,,,,Material,,2,60,,Items,Products,,,,,,,,,,,,,,,,
LinenFabric,,,,1,,3,100,,,,,,"LinenYarn,4",,,,,,A rough linen fabric that covers your basic needs.,,,,Material,,0.5,100,x,,,,,,,,,,,,,,,,,,
LinenYarn,,,,1,,1,20,,,,,,"FlaxFiber,2",,,,,,Flax fibers spun into a usable string commonly known as linen yarn.,,,,Material,,1,30,,,,,,,,,,,,,,,,,,,
MarmotCarcass,,,,,,,1000,,,,,,,,,,,,A dead marmot.,,,,Animal,,,,,,,,,,,,,,,,,,,,,,
MetallurgyResearchPaperAdvanced,,ResearchTable,,0,Smelting,,10,,,,,,"IronBar,10;CopperBar,5",,,,,,A document containing important research information. Used to discover new skills at the research table.,,,,,"Advanced Research,1;Research,1",3,120,,Items,Research Papers,,,,,,,,,,,,,,,,
MetallurgyResearchPaperBasic,,ResearchTable,,0,Mining,,10,,,,,"Ore,10",,,,,,,A document containing important research information. Used to discover new skills at the research table.,,,,Research,"Basic Research,1;Research,1",1.5,30,,Items,Research Papers,,,,,,,,,,,,,,,,
MetallurgyResearchPaperModern,,ResearchTable,,1,AdvancedSmelting,,10,,,,,,"Rebar,6;SteelBar,10",,,,,,A document containing important research information. Used to discover new skills at the research table.,,,,,"Modern Research,1;Research,1",6,600,,Items,Research Papers,,,,,,,,,,,,,,,,
MoonJellyfish,,,,,,,200,,,,,,,,,,,,A moon jellyfish.,,,,Animal,"Fish,1;SmallFish,1",,,,Natural Resources,Animal,,,,,,,,,,,,,,,,
Mortar,,,,,,,500,,,,,,,,,,,Mortar,A binding pitch useful as a mortar.,,,,Material,,,,,Items,Products,,,,,,,,,,,,,,,,
MountainGoatCarcass,,,,,,,3000,,,,,,,,,,,,A dead mountain goat.,,,,Animal,"MediumCarcass,1;MediumWoolyCarcass,1",,,,Natural Resources,Animal,,,,,,,,,,,,,,,,
Nail,,Anvil,,1,Smelting,0.8,500,,,,,,"IronBar,1",,,,16,,Nails used for construction.,,,,Material,,0.5,50,,Items,Products,,,,,,,,,,,,,,,,
NuclearFuel,,,,,,20,10000,,,,,,,,"Tailings,25",,,NuclearFuel,Unstable nuclear fuel.,,,,Fuel,,,,,,,,,,,,,,,,,,,,,,
Nylon,,OilRefinery,,1,OilDrilling,1.5,500,,,,,,"Petroleum,4",,"Barrel,3,-",,2,,Nylon is a synthetic polymer that can be used as a cheap alternative to more natural textiles. ,,,,Material,,1,180,,Items,Products,,,,,,,,,,,,,,,,
NylonChips,,,,,,,,,,,,,,,,,,,,,,,,,,,,,,,,,,,,,,,,,,,,,
NylonFabric,,,,,,,100,,,,,,,,,,,NylonFabric,A synthetic fabric that is desired for its durability and cheap cost to produce.,,,,Material,"Fabric,1",,,,Items,Products,,,,,,,,,,,,,,,,
NylonThread,,SpinMelter,,1,Tailoring,0.75,20,,,,,,"Nylon,2",,,,4,NylonThread,Synthetic thread that has more resistance to abrasion than more natural threads.,,,,Material,,0.5,60,,Items,Products,,,,,,,,,,,,,,,,
OtterCarcass,,,,,,,1000,,,,,,,,,,,,A dead otter.,,,,Animal,"TinyFurCarcass,1;TinyCarcass,1",,,,Natural Resources,Animal,,,,,,,,,,,,,,,,
PacificSardine,,,,,,,150,,,,,,,,,,,,A pacific sardine.,,,,Animal,"Fish,1",,,,Natural Resources,Animal,,,,,,,,,,,,,,,,
Paper,,CarpentryTable,,0,PaperMilling,0.1,100,,,,,,"CelluloseFiber,1",,,100,,,It's paper.,,,,Material,"Burnable Fuel,1",1,20,x,Items,Products,,,,,,,,,,,,,,,,
Picture,,,,,,,,,,,,,,,,,,,A picture displaying a captured moment.,,,,,,,,,,,,,,,,,,,,,,,,,,
Piston,,ScrewPress,,1,Mechanics,1.5,500,,,,,,"IronPipe,2;IronBar,2",,,,,,A moving component that transfers force. Can also function as a valve occasionally.,,MachinistTable,,Material,,2,60,,Items,Products,,,,,,,,,,,,,,,,
PlantFibers,,,,,,,10,,,,,,,,,100,,,"Harvested from a number of plants, these fibers are useful for a surprising number of things.",,,,Material,"NaturalFiber,1;Burnable Fuel,1;Crop,1",,,,Items,Products,,,,,,,,,,,,,,,,
Plastic,,OilRefinery,,1,OilDrilling,1.5,1000,,,,,,"Petroleum,4",,"Barrel,3,-",,2,Plastic,An extremely useful synthetic material derived from petrochemicals.,,,,Material,,1,180,x,Items,Products,,,,,,,,,,,,,,,,
PortableSteamEngine,,MachinistTable,,1,Mechanics,8,5000,,,,,,"Piston,8;Screws,18;IronPlate,12;Boiler,3;IronGear,12;CopperPipe,6",,,,,,An engine that generates mechanical power through steam.,,,,Material,,10,1200,,Items,Products,,,,,,,,,,,,,,,,
PrairieDogCarcass,,,,,,,1000,,,,,,,,,,,,A dead prairie dog.,,,,Animal,"TinyLeatherCarcass,1;TinyCarcass,1",,,,Natural Resources,Animal,,,,,,,,,,,,,,,,
PropertyClaim,,,,,,,100,,,,,,,,,,,Land Claim Papers,Use to claim a section of land as your own.,,,Land Claim Paper,Tool,,,,x,Items,Tools,,,,,,,,,,,,,,,,
PropertyTool,Tool,ToolBench,,,,0.5,1000,,,,,"Wood,10",,,,,,Land Claim Stakes,"Used to claim, unclaim, and examine property.\n\nWhen claiming:\n- Hold Ctrl to create a new deed.\n- Hold Shift to choose from nearby deeds.\nWhen unclaiming:\n- Hold Ctrl to unclaim an entire deed.\n- Hold Shift to move plot to a nearby deed.",,,Land Claim Stake,Tool,"Tool,1",,200,,Items,Tools,,,,,,,,,,,,,,,,
Quicklime,,BlastFurnace,,1,AdvancedSmelting,0.2,500,,,,,,"CrushedLimestone,1",,,,,,A chemical compound used in steel production.,,,,Material,,0.1,50,,Items,Products,,,,,,,,,,,,,,,,
Radiator,,ElectricStampingPress,,1,Industry,1.5,500,,,,,,"HeatSink,4;CopperWiring,8",,,,,,A heat sink that uses liquid running through copper fins to disperse heat build-up.,,,,Material,,3,35,,Items,Products,,,,,,,,,,,,,,,,
Rebar,,BlastFurnace,,2,AdvancedSmelting,0.2,3000,,,,,,"SteelBar,2",,,,,,Ribbed steel bars for reinforcing stuctures.,,,,Material,,2,50,,Items,Products,,,,,,,,,,,,,,,,
Rivet,,BlastFurnace,,2,AdvancedSmelting,0.8,2000,,,,,,"SteelBar,1",,,,3,,An iron bolt used to hold together inventions.,,,,Material,,1,85,,Items,Products,,,,,,,,,,,,,,,,
RubberWheel,,ElectricLathe,,1,Industry,2,2000,,,,,,"SyntheticRubber,8;SteelBar,4",,,,,,Rubber wheels provide much better traction and allow the construction of more modern vehicles.,,,,,,3.5,60,,Items,Products,,,,,,,,,,,,,,,,
Salmon,,,,,,,1000,,,,,,,,,,,,A salmon.,,,,Animal,"Fish,1;MediumFish,1",,,,Natural Resources,Animal,,,,,,,,,,,,,,,,
Screws,,Lathe,,1,Mechanics,2,500,,,,,,"IronBar,1",,,,4,,A pointed metal fastener used in crafting to attach pieces of material together.,,MachinistTable,,Material,,1,25,,Items,Products,,,,,,,,,,,,,,,,
Servo,,ElectricMachinistTable,,2,Mechanics,3,500,,,,,,"BasicCircuit,2;Fiberglass,5",,,,,,A rotary actuator that allows for control over angular position.,,,,Material,,2,60,,Items,Products,,,,,,,,,,,,,,,,
ShornWool,,,,,,,,,,,,,,,,,,,Wool that has been shorn from an animal.,,,,Material,,,,,Items,Products,,,,,,,,,,,,,,,,
SmallHangingWoodSign,,CarpentryTable,,1,Carpentry,2,,,,x,,"WoodBoard,2;HewnLog,4;Wood,5",,,,,,,A small sign for all of your smaller text needs!,,,,,,1,25,,,,,,,,,,,,,,,,,,,
SmallStandingWoodSign,,CarpentryTable,,1,Carpentry,2,,,,x,,"WoodBoard,2;HewnLog,4;Wood,5",,,,,,,A small sign for all of your smaller text needs!,,,,,,1,25,,,,,,,,,,,,,,,,,,,
SnappingTurtleCarcass,,,,,,,2000,,,,,,,,,,,,A dead snapping turtle.,,,,Animal,"TinyLeatherCarcass,1;TinyCarcass,1",,,,Natural Resources,Animal,,,,,,,,,,,,,,,,
SoftwoodBoard,,CarpentryTable,,1,Carpentry,0.2,500,,,,Board,,"SoftwoodHewnLog,1",,,2000,,,A higher quality softwood board used for long lasting furniture.,,,,Material,"WoodBoard,1;Burnable Fuel,1",0.6,25,x,Items,Products,,,,,,,,,,,,,,,,
SoilSampler,,ToolBench,,0,Fertilizers,4,1000,,,,,"Wood,2;WoodBoard,2",,,,,,,"Checking the moisture levels, temperature, and nutrients of soil is important for farming.",,,,Tool,,1,50,,Items,Tools,,,,,,,,,,,,,,,,
SpoiledFood,,,,,,,10,,,,,,,,,,,,Food that has spoiled beyond the point of being suitable for human consumption. It can still be used for compost.,,,,,,,,,Items,Products,,,,,,,,,,,,,,,,
SteamTractorHarvester,VehicleTool,AssemblyLine,,2,Mechanics,2,10000,Mechanical,2500,,,,"IronPlate,12;Screws,12;IronPipe,8",,,,,,An attachment for the steam tractor that allows for quick harvesting of plants.,,,,Tool,,10,120,,Items,Tools,,,,,,,,,,,,,,,,
SteamTractorPlow,VehicleTool,AssemblyLine,,2,Mechanics,2,10000,Mechanical,2500,,,,"IronPlate,8;Screws,18",,,,,,An attachment for the steam tractor that allows for quick plowing.,,,,Tool,,10,120,,Items,Tools,,,,,,,,,,,,,,,,
SteamTractorSower,VehicleTool,AssemblyLine,,2,Mechanics,2,10000,Mechanical,2500,,,,"IronPlate,8;Screws,18;IronPipe,8",,,,,,An attachment for the steam tractor that allows for quick planting of seeds.,,,,Tool,,10,120,,Items,Tools,,,,,,,,,,,,,,,,
SteelAxle,,ElectricLathe,,1,Industry,1.5,500,,,,,,"SteelBar,4;Epoxy,3",,,,,,A rotating steel rod that can be fixed to wheels for use in vehicles.,,,,Material,,1,60,,Items,Products,,,,,,,,,,,,,,,,
SteelGear,,ElectricPlaner,,1,Industry,0.4,500,,,,,,"SteelBar,2;Epoxy,1",,,,,,A toothed machine part that interlocks with others.,,,,Material,"Gear,1",1,60,,Items,Products,,,,,,,,,,,,,,,,
SteelGearbox,,ElectricPlaner,,2,Industry,2,500,,,,,,"SteelBar,8;SteelGear,4",,,,,,Provides speed and torque conversions from a rotating power source to another device.,,,,Material,,2.5,100,,Items,Products,,,,,,,,,,,,,,,,
SteelPlate,,ElectricStampingPress,,1,Industry,1.5,500,,,,,,"SteelBar,3",,,,,,A sturdy steel plate for use in various crafting recipes.,,,,Material,,1,120,x,Items,Products,,,,,,,,,,,,,,,,
SteelSawBlade,,Anvil,,2,AdvancedSmelting,1.2,100,,,,,,"SteelBar,10",,,,,,A disc shaped steel saw that can be attached to rotary machines to shape wood and masonry products.,,,,Material,,2,180,,Items,Products,,,,,,,,,,,,,,,,
StrangeFuel,,,,,,,100,,,,,,,,,10000000,,,CHEEEAAAAATER,,,,Fuel,,,,,,,,,,,,,,,,,,,,,,
Substrate,,ElectronicsAssembly,,1,Electronics,2,1000,,,,,,"Fiberglass,4;Epoxy,4",,,,,,The foundation material for complex electronics.,,,,Material,,2,60,,Items,Products,,,,,,,,,,,,,,,,
SyntheticRubber,,OilRefinery,,1,OilDrilling,1.5,1000,,,,,,"Petroleum,4",,"Barrel,3,-",,2,Rubber,An extremely useful synthetic material derived from petrochemicals.,,,,Material,,1,180,,Items,Products,,,,,,,,,,,,,,,,
Torch,Tool,Workbench,,,,0.5,500,,,,,"Wood,2",,,,8000,,,A little bit of light to help beat back the night.,,,,Tool,"Torch,1",,50,,Items,Tools,,,,,,,,,,,,,,,,
Trout,,,,,,,800,,,,,,,,,,,,A trout.,,,,Animal,"Fish,1;MediumFish,1",,,,Natural Resources,Animal,,,,,,,,,,,,,,,,
Tuna,,,,,,,1250,,,,,,,,,,,,A tuna.,,,,Animal,"Fish,1;LargeFish,1",,,,Natural Resources,Animal,,,,,,,,,,,,,,,,
TurkeyCarcass,,,,,,,1000,,,,,,,,,,,,A dead turkey.,,,,Animal,"TinyLeatherCarcass,1;TinyCarcass,1",,,,Natural Resources,Animal,,,,,,,,,,,,,,,,
Urchin,,,,,,,100,,,,,,,,,,,,An urchin.,,,,Animal,"Marine Life,1",,,,Natural Resources,Animal,,,,,,,,,,,,,,,,
Valve,,ElectricMachinistTable,,2,Mechanics,3,500,,,,,,"SteelPipe,4;SteelPlate,4","SteelGearbox,1",,,,,"A device that regulates, directs, or controls the flow of fluid.",,,,Material,,4,60,,Items,Products,,,,,,,,,,,,,,,,
WolfCarcass,,,,,,,2000,,,,,,,,,,,,A dead wolf.,,,,Animal,"SmallCarcass,1",,,,Natural Resources,Animal,,,,,,,,,,,,,,,,
WoodenWheel,,WainwrightTable,,1,BasicEngineering,2,500,,,,,"HewnLog,4",,,,,,,A basic wheel for use in early wooden vehicles.,,,,Material,,1,40,,Items,Products,,,,,,,,,,,,,,,,
WoodPulp,,,,,,,10,,,,,,,,,50,,WoodPulp,"A byproduct of processing lumber, wood pulp can be burned for Mortar or pressed into paper.",,,,Material,"NaturalFiber,1;Burnable Fuel,1",,,,Items,Products,,,,,,,,,,,,,,,,
